Data_Partition,Cluster_ID,Top_Keywords,Topic_Summarization,Number_of_Posts
part_d,1381,"[{'term': 'kirk', 'score': 18015.0}, {'term': 'trump', 'score': 12430.0}, {'term': 'charlie', 'score': 10911.0}, {'term': 'maga', 'score': 5658.0}, {'term': 'epstein', 'score': 3658.0}, {'term': 'files', 'score': 2937.0}, {'term': 'right', 'score': 2348.0}, {'term': 'death', 'score': 2104.0}, {'term': 'like', 'score': 1891.0}, {'term': 'people', 'score': 1825.0}]","{'title': ""Charlie Kirk's Murder and Political Exploitation"", 'description': ""The posts center on the controversial death of right-wing influencer Charlie Kirk, with widespread speculation that his killing was exploited by Donald Trump and the MAGA movement for political gain. Many argue the narrative blaming the left is a cover for internal MAGA conflict, while others highlight Kirk's hateful rhetoric and the irony of his posthumous martyrdom.""}",14773
part_b,286,"[{'term': 'trump', 'score': 16265.0}, {'term': 'plane', 'score': 5595.0}, {'term': 'faa', 'score': 5495.0}, {'term': 'air', 'score': 5287.0}, {'term': 'crash', 'score': 3275.0}, {'term': 'administration', 'score': 3063.0}, {'term': 'crashes', 'score': 3047.0}, {'term': 'musk', 'score': 3002.0}, {'term': 'traffic', 'score': 2673.0}, {'term': 'just', 'score': 2148.0}]","{'title': ""Trump and Musk's FAA Purge Sparks Air Safety Crisis"", 'description': 'A surge in plane crashes and aviation incidents is being linked to the recent mass firings of Federal Aviation Administration (FAA) employees under the Trump administration, with critics blaming the cuts to air traffic control staff and safety infrastructure. The posts express widespread concern over declining air safety, political blame, and growing public fear of flying.'}",14550
part_d,1370,"[{'term': 'republican', 'score': 14874.0}, {'term': 'party', 'score': 3646.0}, {'term': 'just', 'score': 1302.0}, {'term': 'like', 'score': 1135.0}, {'term': 'lie', 'score': 776.0}, {'term': 'republicans', 'score': 727.0}, {'term': 'lies', 'score': 647.0}, {'term': 'know', 'score': 589.0}, {'term': 'don', 'score': 586.0}, {'term': 'lying', 'score': 585.0}]","{'title': 'The Decline of the Republican Party', 'description': 'These posts express deep disillusionment with the modern Republican Party, portraying it as hypocritical, dishonest, and morally bankrupt. The recurring theme is a loss of integrity, with widespread criticism of its leadership, values, and behavior under MAGA influence.'}",14519
part_b,694,"[{'term': 'trump', 'score': 18672.0}, {'term': 'china', 'score': 16044.0}, {'term': 'xi', 'score': 4237.0}, {'term': 'trade', 'score': 2794.0}, {'term': 'chinese', 'score': 2255.0}, {'term': 'war', 'score': 1569.0}, {'term': 'tariffs', 'score': 1437.0}, {'term': 'just', 'score': 1382.0}, {'term': 'world', 'score': 1379.0}, {'term': 'like', 'score': 1365.0}]","{'title': 'Trump vs. China: A Global Power Shift', 'description': ""The posts reflect widespread concern that Donald Trump's confrontational foreign policy is inadvertently empowering China, with many believing Xi Jinping holds a strategic advantage. The cluster highlights perceptions of Trump as impulsive and ineffective, while portraying China as patient, calculating, and increasingly dominant on the world stage.""}",14512
part_a,658,"[{'term': 'trump', 'score': 16636.0}, {'term': 'uk', 'score': 7274.0}, {'term': 'farage', 'score': 5658.0}, {'term': 'starmer', 'score': 5055.0}, {'term': 'eu', 'score': 2879.0}, {'term': 'brexit', 'score': 2681.0}, {'term': 'musk', 'score': 2109.0}, {'term': 'reform', 'score': 1969.0}, {'term': 'like', 'score': 1805.0}, {'term': 'labour', 'score': 1636.0}]","{'title': 'UK Politics in the Shadow of Trump and Musk', 'description': ""The posts critique the growing influence of Donald Trump and Elon Musk on UK politics, particularly through figures like Nigel Farage and the Reform Party. They express concern over the UK's alignment with right-wing populism, the erosion of the EU relationship, and the perceived betrayal of British interests in favor of transatlantic populism.""}",14456
part_a,837,"[{'term': 'maga', 'score': 15643.0}, {'term': 'block', 'score': 12456.0}, {'term': 'list', 'score': 10328.0}, {'term': 'lists', 'score': 6571.0}, {'term': 'bsky', 'score': 3888.0}, {'term': 'accounts', 'score': 2985.0}, {'term': 'profile', 'score': 2979.0}, {'term': 'app', 'score': 2786.0}, {'term': 'people', 'score': 2615.0}, {'term': 'subscribe', 'score': 2343.0}]","{'title': 'MAGA Blocklists on Bluesky', 'description': 'Users are sharing, subscribing to, and debating the use of curated blocklists targeting MAGA-affiliated accounts on Bluesky. While many find these lists effective for reducing toxic content, concerns remain about accuracy, potential misuse, and the risk of accidentally blocking allies.'}",14369
part_c,326,"[{'term': 'trump', 'score': 22709.0}, {'term': 'qatar', 'score': 11312.0}, {'term': 'plane', 'score': 8496.0}, {'term': 'jet', 'score': 6571.0}, {'term': 'gift', 'score': 5625.0}, {'term': 'air', 'score': 5371.0}, {'term': 'force', 'score': 5345.0}, {'term': 'president', 'score': 3234.0}, {'term': 'luxury', 'score': 3153.0}, {'term': 'accept', 'score': 2960.0}]","{'title': ""Trump's Qatar Jet Gift Controversy"", 'description': ""A cluster of posts criticizes President Trump's plan to accept a luxury Boeing 747-8 jet from Qatar as Air Force One, highlighting concerns over corruption, ethics violations, and the fact that Trump would retain ownership after his presidency. The posts argue the deal amounts to a foreign bribe and a misuse of public funds for private benefit.""}",14329