Data_Partition,Cluster_ID,Top_Keywords,Topic_Summarization,Number_of_Posts
part_a,750,"[{'term': 'trump', 'score': 21245.0}, {'term': 'tariffs', 'score': 18775.0}, {'term': 'tariff', 'score': 4243.0}, {'term': 'prices', 'score': 2944.0}, {'term': 'just', 'score': 2755.0}, {'term': 'maga', 'score': 2219.0}, {'term': 'people', 'score': 2218.0}, {'term': 'going', 'score': 2070.0}, {'term': 'pay', 'score': 2010.0}, {'term': 'like', 'score': 1956.0}]","{'title': ""Trump's Tariff Obsession: Bluster, Backlash, and Economic Reality"", 'description': ""The posts critique Donald Trump's repeated promotion of tariffs as a political tool, highlighting widespread confusion among supporters, the economic consequences for American consumers, and skepticism about his understanding of trade policy. Many emphasize that tariffs ultimately raise prices, hurt ordinary families, and serve as a self-serving strategy rather than genuine economic reform.""}",19121
part_b,487,"[{'term': 'trump', 'score': 24925.0}, {'term': 'research', 'score': 12777.0}, {'term': 'science', 'score': 7603.0}, {'term': 'cancer', 'score': 6778.0}, {'term': 'administration', 'score': 6755.0}, {'term': 'funding', 'score': 6335.0}, {'term': 'nih', 'score': 5856.0}, {'term': 'scientists', 'score': 4760.0}, {'term': 'cuts', 'score': 4560.0}, {'term': 'health', 'score': 3238.0}]","{'title': ""Trump's Assault on Scientific Research"", 'description': ""A cluster of posts highlights widespread outrage over the Trump administration's cuts to federal science funding, particularly at the NIH and NSF, and its impact on cancer, Alzheimer’s, and other critical medical research. Scientists, survivors, and advocates warn of a brain drain, eroded public health, and a dangerous retreat from evidence-based policy.""}",19093
part_a,518,"[{'term': 'trump', 'score': 27550.0}, {'term': 'amendment', 'score': 10136.0}, {'term': '14th', 'score': 8992.0}, {'term': 'office', 'score': 6507.0}, {'term': 'court', 'score': 6388.0}, {'term': 'ballot', 'score': 6293.0}, {'term': 'president', 'score': 5110.0}, {'term': 'constitution', 'score': 5036.0}, {'term': 'congress', 'score': 4895.0}, {'term': 'supreme', 'score': 4732.0}]","{'title': 'Trump Disqualification Under 14th Amendment', 'description': ""Posts center on the legal and constitutional debate over whether Donald Trump is disqualified from holding office under Section 3 of the 14th Amendment due to his role in the January 6 insurrection. Multiple state courts have ruled he engaged in insurrection, but the U.S. Supreme Court's decision will determine his eligibility to remain on the 2024 ballot.""}",19067
part_c,1003,"[{'term': 'pope', 'score': 22992.0}, {'term': 'trump', 'score': 17351.0}, {'term': 'maga', 'score': 7153.0}, {'term': 'leo', 'score': 6231.0}, {'term': 'new', 'score': 5482.0}, {'term': 'american', 'score': 4638.0}, {'term': 'xiv', 'score': 3289.0}, {'term': 'catholic', 'score': 3155.0}, {'term': 'catholics', 'score': 2321.0}, {'term': 'vance', 'score': 2196.0}]","{'title': ""Trump's Obsession with the American Pope"", 'description': ""The posts center on Donald Trump's increasingly absurd claims and reactions to the election of Pope Leo XIV, the first American pope, including his attempts to claim credit, post AI-generated images of himself as pope, and frame the papal election as a personal victory—despite the pope's clear distance from Trump's ideology and the Vatican's independence from U.S. politics.""}",18948
part_b,730,"[{'term': 'trump', 'score': 31485.0}, {'term': 'approval', 'score': 12576.0}, {'term': 'poll', 'score': 9362.0}, {'term': 'rating', 'score': 7129.0}, {'term': 'president', 'score': 6352.0}, {'term': 'americans', 'score': 4832.0}, {'term': 'polls', 'score': 4704.0}, {'term': 'donald', 'score': 4620.0}, {'term': 'new', 'score': 3918.0}, {'term': 'news', 'score': 3041.0}]","{'title': ""Trump's Approval Ratings Plummet Amid Economic Concerns"", 'description': ""Multiple recent polls show Donald Trump's approval ratings sinking to historic lows, with disapproval exceeding approval across key metrics. Voters express growing concern over his economic policies, perceived overreach of power, and the impact of his administration's rapid changes.""}",18446
part_c,365,"[{'term': 'trump', 'score': 19608.0}, {'term': 'project', 'score': 18864.0}, {'term': '2025', 'score': 18429.0}, {'term': 'maga', 'score': 3201.0}, {'term': 'people', 'score': 2719.0}, {'term': 'just', 'score': 2442.0}, {'term': 'heritage', 'score': 2067.0}, {'term': 'vought', 'score': 1913.0}, {'term': 'plan', 'score': 1836.0}, {'term': 'foundation', 'score': 1836.0}]","{'title': 'Project 2025: Trump as a Puppet', 'description': ""These posts collectively argue that Donald Trump is a figurehead for the far-right 'Project 2025' agenda, orchestrated by the Heritage Foundation and conservative elites. They claim Trump lied about his ignorance of the plan, while his administration rapidly implements its authoritarian, anti-democratic policies.""}",18338
part_d,1208,"[{'term': 'trump', 'score': 18908.0}, {'term': 'media', 'score': 15264.0}, {'term': 'news', 'score': 3091.0}, {'term': 'press', 'score': 2686.0}, {'term': 'like', 'score': 2258.0}, {'term': 'just', 'score': 2172.0}, {'term': 'people', 'score': 1660.0}, {'term': 'don', 'score': 1512.0}, {'term': 'journalists', 'score': 1463.0}, {'term': 'owned', 'score': 1394.0}]","{'title': 'Mainstream Media Complicity with Trump', 'description': 'The posts collectively criticize the mainstream media for being controlled by right-wing billionaires and complicit in enabling Donald Trump’s rhetoric and actions. They argue that corporate media outlets prioritize profit and political alignment over accountability, failing to challenge Trump’s lies and undermining democratic integrity.'}",18229
part_c,894,"[{'term': 'trump', 'score': 19992.0}, {'term': 'pedophile', 'score': 8343.0}, {'term': 'rapist', 'score': 4305.0}, {'term': 'donald', 'score': 3134.0}, {'term': 'child', 'score': 2441.0}, {'term': 'children', 'score': 2134.0}, {'term': 'pedo', 'score': 1929.0}, {'term': 'raped', 'score': 1651.0}, {'term': 'girls', 'score': 1594.0}, {'term': 'pedophiles', 'score': 1560.0}]","{'title': 'Trump Allegations: Pedophilia Claims', 'description': 'A cluster of social media posts repeatedly accuse Donald Trump of being a pedophile, using strong, inflammatory language. The posts center on the allegation that Trump has a history of sexual abuse involving minors, framing him as a predatory figure and criticizing supporters who defend him.'}",17808
part_c,1063,"[{'term': 'trump', 'score': 19582.0}, {'term': 'lies', 'score': 6920.0}, {'term': 'lie', 'score': 4826.0}, {'term': 'lying', 'score': 4079.0}, {'term': 'liar', 'score': 2854.0}, {'term': 'truth', 'score': 2602.0}, {'term': 'says', 'score': 1969.0}, {'term': 'just', 'score': 1812.0}, {'term': 'believe', 'score': 1657.0}, {'term': 'know', 'score': 1656.0}]","{'title': ""Trump's Pattern of Constant Lying"", 'description': 'The posts collectively condemn Donald Trump as a habitual and pathological liar, emphasizing his repeated false statements, disregard for facts, and the widespread belief that his every claim should be taken as the opposite of the truth. The cluster highlights the normalization of his misinformation across his presidency and beyond.'}",17704
part_b,765,"[{'term': 'trump', 'score': 28229.0}, {'term': 'law', 'score': 19283.0}, {'term': 'firms', 'score': 12019.0}, {'term': 'firm', 'score': 10777.0}, {'term': 'order', 'score': 4980.0}, {'term': 'executive', 'score': 4510.0}, {'term': 'legal', 'score': 4167.0}, {'term': 'lawyers', 'score': 4135.0}, {'term': 'weiss', 'score': 3695.0}, {'term': 'paul', 'score': 3658.0}]","{'title': 'Big Law Firms Under Pressure from Trump', 'description': 'A cluster of posts highlights the growing tension between major U.S. law firms and the Trump administration, as firms face executive orders, threats to security clearances, and demands for pro bono work. Many firms have capitulated, sparking widespread criticism over compromised legal independence and ethical concerns.'}",17703
part_d,153,"[{'term': 'trump', 'score': 20445.0}, {'term': 'project', 'score': 18801.0}, {'term': '2025', 'score': 18532.0}, {'term': 'maga', 'score': 2764.0}, {'term': 'people', 'score': 2520.0}, {'term': 'vought', 'score': 2496.0}, {'term': 'just', 'score': 2057.0}, {'term': 'heritage', 'score': 1862.0}, {'term': 'plan', 'score': 1853.0}, {'term': 'foundation', 'score': 1606.0}]","{'title': 'Project 2025: Authoritarian Blueprint in Action', 'description': 'These posts collectively condemn Project 2025 as a coordinated, far-right agenda to dismantle democratic institutions, impose Christian nationalism, and consolidate authoritarian power under the guise of a Trump-led administration. Critics argue Trump is a puppet for the Heritage Foundation and extremist allies, with the plan already being implemented through mass deportations, attacks on civil servants, and the erosion of civil liberties.'}",17489
part_b,594,"[{'term': 'social', 'score': 24490.0}, {'term': 'security', 'score': 23792.0}, {'term': 'trump', 'score': 19029.0}, {'term': 'musk', 'score': 9788.0}, {'term': 'people', 'score': 4297.0}, {'term': 'administration', 'score': 3870.0}, {'term': 'elon', 'score': 3599.0}, {'term': 'doge', 'score': 3441.0}, {'term': 'benefits', 'score': 2931.0}, {'term': 'ss', 'score': 2108.0}]","{'title': 'Trump and Musk Attack Social Security', 'description': 'A coordinated effort by Donald Trump and Elon Musk to undermine the Social Security Administration through staff cuts, office closures, and false claims about fraud is sparking widespread concern. Critics argue these actions are part of a broader strategy to privatize the program and benefit billionaires, despite Social Security being a vital lifeline for millions of Americans.'}",17109
part_b,793,"[{'term': 'trump', 'score': 18625.0}, {'term': 'court', 'score': 8430.0}, {'term': 'scotus', 'score': 6201.0}, {'term': 'supreme', 'score': 4645.0}, {'term': 'immunity', 'score': 2346.0}, {'term': 'judges', 'score': 2106.0}, {'term': 'courts', 'score': 2096.0}, {'term': 'orders', 'score': 1878.0}, {'term': 'just', 'score': 1837.0}, {'term': 'law', 'score': 1657.0}]","{'title': 'Trump Ignores Courts, SCOTUS Undermined', 'description': ""The posts express widespread concern that Donald Trump is openly defying court rulings, with the Supreme Court's recent immunity decision enabling him to act with impunity. Many argue the judiciary has lost its power and credibility, especially under a conservative-majority court perceived as aligned with Trump.""}",17066
part_a,398,"[{'term': 'trump', 'score': 17864.0}, {'term': 'tax', 'score': 15977.0}, {'term': 'cuts', 'score': 7106.0}, {'term': 'taxes', 'score': 5391.0}, {'term': 'debt', 'score': 3616.0}, {'term': 'pay', 'score': 3430.0}, {'term': 'rich', 'score': 3045.0}, {'term': 'cut', 'score': 2640.0}, {'term': 'republican', 'score': 2282.0}, {'term': 'trillion', 'score': 2119.0}]","{'title': ""Trump's Tax Cuts: Wealthy First, Working Class Pay"", 'description': 'These posts criticize the proposed extension of Trump-era tax cuts, highlighting how they disproportionately benefit the wealthy while threatening vital programs for the poor and middle class. The cluster underscores concerns over growing debt, IRS underfunding, and the political prioritization of billionaire interests over public welfare.'}",17051
part_c,635,"[{'term': 'trump', 'score': 27826.0}, {'term': 'south', 'score': 19751.0}, {'term': 'white', 'score': 17943.0}, {'term': 'africa', 'score': 9028.0}, {'term': 'president', 'score': 8704.0}, {'term': 'african', 'score': 6777.0}, {'term': 'africans', 'score': 5711.0}, {'term': 'genocide', 'score': 5666.0}, {'term': 'refugees', 'score': 4293.0}, {'term': 'ramaphosa', 'score': 4205.0}]","{'title': ""Trump's False 'White Genocide' Claims in South Africa"", 'description': ""The posts critique Donald Trump's baseless assertion of a 'white genocide' in South Africa, exposing the use of manipulated footage from Congo and the administration's preferential refugee status for white Afrikaners. They highlight the racial hypocrisy, misinformation, and geopolitical manipulation behind the narrative.""}",16964
part_c,993,"[{'term': 'trump', 'score': 20755.0}, {'term': 'musk', 'score': 14528.0}, {'term': 'elon', 'score': 8592.0}, {'term': 'like', 'score': 2157.0}, {'term': 'just', 'score': 1881.0}, {'term': 'fight', 'score': 1441.0}, {'term': 'feud', 'score': 1390.0}, {'term': 'donald', 'score': 1378.0}, {'term': 'vs', 'score': 1218.0}, {'term': 'going', 'score': 1124.0}]","{'title': 'Trump and Musk Feud: Political Breakup Drama', 'description': 'A public and escalating feud between Donald Trump and Elon Musk has captivated social media, with both figures trading barbs over politics, power, and personal betrayal. The clash, framed as a dramatic breakup of a once-transactional alliance, has drawn comparisons to reality TV and high school drama, sparking widespread speculation about its real-world implications.'}",16898
part_a,248,"[{'term': 'hegseth', 'score': 20477.0}, {'term': 'trump', 'score': 19420.0}, {'term': 'pete', 'score': 8832.0}, {'term': 'defense', 'score': 6575.0}, {'term': 'secretary', 'score': 5154.0}, {'term': 'military', 'score': 3238.0}, {'term': 'republican', 'score': 2997.0}, {'term': 'news', 'score': 2493.0}, {'term': 'fox', 'score': 2429.0}, {'term': 'pick', 'score': 2320.0}]","{'title': ""Trump's Unqualified Defense Pick Sparks Outrage"", 'description': ""The posts express widespread concern over Donald Trump's nomination of Fox News host Pete Hegseth as Secretary of Defense, citing his alleged sexual misconduct, drinking issues, lack of military experience, and loyalty to Trump over national security. Critics argue the appointment signals a dangerous shift toward authoritarian control of the military.""}",16741
part_a,127,"[{'term': 'dei', 'score': 19354.0}, {'term': 'trump', 'score': 16852.0}, {'term': 'maga', 'score': 3669.0}, {'term': 'white', 'score': 3472.0}, {'term': 'diversity', 'score': 3183.0}, {'term': 'people', 'score': 3128.0}, {'term': 'federal', 'score': 2995.0}, {'term': 'administration', 'score': 2301.0}, {'term': 'inclusion', 'score': 2155.0}, {'term': 'hire', 'score': 2118.0}]","{'title': ""MAGA's War on DEI: A Mask for Bigotry"", 'description': 'These posts expose how the Republican attack on Diversity, Equity, and Inclusion (DEI) is a thinly veiled campaign against racial, gender, and social equity—using DEI as a scapegoat to justify systemic discrimination, promote white male supremacy, and dismantle civil rights progress.'}",16628
part_d,379,"[{'term': 'miller', 'score': 20305.0}, {'term': 'trump', 'score': 19734.0}, {'term': 'stephen', 'score': 9452.0}, {'term': 'president', 'score': 2263.0}, {'term': 'like', 'score': 2159.0}, {'term': 'just', 'score': 2073.0}, {'term': 'running', 'score': 1449.0}, {'term': 'people', 'score': 1394.0}, {'term': 'think', 'score': 1357.0}, {'term': 'know', 'score': 1119.0}]","{'title': ""Stephen Miller's Shadow Rule in Trump's Administration"", 'description': ""These posts collectively condemn Stephen Miller as the true power behind Donald Trump's administration, accusing him of being a far-right extremist, architect of cruel policies, and a manipulative force driving authoritarian agendas. The recurring theme is that Miller, not Trump, is the real decision-maker, wielding unchecked influence over immigration, national security, and political strategy.""}",16544
part_c,1473,"[{'term': 'trump', 'score': 20528.0}, {'term': 'putin', 'score': 19311.0}, {'term': 'like', 'score': 2477.0}, {'term': 'just', 'score': 1627.0}, {'term': 'knows', 'score': 841.0}, {'term': 'does', 'score': 833.0}, {'term': 'know', 'score': 771.0}, {'term': 'think', 'score': 763.0}, {'term': 'puppet', 'score': 750.0}, {'term': 'doesn', 'score': 730.0}]","{'title': 'Trump and Putin: Power Imbalance and Alleged Subservience', 'description': 'These posts collectively depict a recurring narrative that Donald Trump is subservient to Vladimir Putin, portraying their relationship as one of dominance and humiliation. The sentiment emphasizes perceived weakness in Trump’s foreign policy and a belief that Putin manipulates him for geopolitical advantage.'}",16193
part_a,185,"[{'term': 'trump', 'score': 21818.0}, {'term': 'assassination', 'score': 5720.0}, {'term': 'attempt', 'score': 4376.0}, {'term': 'shot', 'score': 4371.0}, {'term': 'donald', 'score': 3096.0}, {'term': 'shooter', 'score': 2783.0}, {'term': 'shooting', 'score': 2554.0}, {'term': 'rally', 'score': 2477.0}, {'term': 'ear', 'score': 1968.0}, {'term': 'president', 'score': 1961.0}]","{'title': 'Trump Assassination Attempt Conspiracy Theories', 'description': ""A cluster of social media posts centered on widespread skepticism and conspiracy theories surrounding a recent attempted assassination of Donald Trump. Many users question the authenticity of the event, speculate about staged attacks, and suggest motives ranging from political manipulation to insider plots, despite official reports confirming the incident and the shooter's arrest.""}",16180
part_a,822,"[{'term': 'maga', 'score': 16688.0}, {'term': 'stupid', 'score': 1560.0}, {'term': 'just', 'score': 1427.0}, {'term': 'like', 'score': 1216.0}, {'term': 'people', 'score': 1124.0}, {'term': 'don', 'score': 1116.0}, {'term': 'fuck', 'score': 840.0}, {'term': 'know', 'score': 833.0}, {'term': 'think', 'score': 831.0}, {'term': 'shit', 'score': 606.0}]","{'title': 'MAGA Criticism and Insults', 'description': 'The posts collectively express strong negative sentiment toward MAGA supporters, repeatedly labeling them as unintelligent, hateful, and delusional. The tone is hostile and mocking, focusing on perceived stupidity and ideological extremism.'}",16037
part_b,481,"[{'term': 'trump', 'score': 19189.0}, {'term': 'dutton', 'score': 9115.0}, {'term': 'australia', 'score': 8937.0}, {'term': 'election', 'score': 3239.0}, {'term': 'australian', 'score': 2486.0}, {'term': 'like', 'score': 2371.0}, {'term': 'peter', 'score': 2185.0}, {'term': 'party', 'score': 2168.0}, {'term': 'labor', 'score': 2014.0}, {'term': 'albanese', 'score': 1984.0}]","{'title': 'Australia Rejects Trump-Style Politics', 'description': ""Australian voters delivered a decisive rebuke to right-wing populism, rejecting opposition leader Peter Dutton's perceived alignment with Donald Trump. The election outcome reflects growing public resistance to MAGA-style policies and a shift toward independent foreign policy and stability.""}",15991
part_b,692,"[{'term': 'trump', 'score': 17374.0}, {'term': 'market', 'score': 11376.0}, {'term': 'stock', 'score': 6909.0}, {'term': 'markets', 'score': 3189.0}, {'term': 'trading', 'score': 3118.0}, {'term': 'insider', 'score': 3017.0}, {'term': 'just', 'score': 1789.0}, {'term': 'biden', 'score': 1741.0}, {'term': 'manipulation', 'score': 1733.0}, {'term': 'like', 'score': 1361.0}]","{'title': 'Trump Market Manipulation Allegations', 'description': 'The posts allege that Donald Trump is intentionally manipulating the stock market to benefit himself and his wealthy associates through insider trading and market crashes, with critics calling it illegal and corrupt. The central theme revolves around accusations of economic sabotage for personal gain, amid widespread concern over systemic financial misconduct.'}",15902
part_d,995,"[{'term': 'trump', 'score': 17198.0}, {'term': 'lies', 'score': 6347.0}, {'term': 'lie', 'score': 4680.0}, {'term': 'lying', 'score': 3593.0}, {'term': 'truth', 'score': 2316.0}, {'term': 'liar', 'score': 2105.0}, {'term': 'says', 'score': 1878.0}, {'term': 'just', 'score': 1750.0}, {'term': 'believe', 'score': 1482.0}, {'term': 'know', 'score': 1287.0}]","{'title': ""Trump's Pattern of Constant Lying"", 'description': ""The posts consistently accuse Donald Trump of being a habitual and pathological liar, asserting that his statements are almost always false, misleading, or fabricated. The cluster emphasizes a widespread belief that Trump's rhetoric is fundamentally dishonest, with no credibility attached to his words.""}",15589
part_a,78,"[{'term': 'trump', 'score': 18384.0}, {'term': 'carter', 'score': 16787.0}, {'term': 'jimmy', 'score': 9057.0}, {'term': 'president', 'score': 7486.0}, {'term': 'funeral', 'score': 6810.0}, {'term': 'donald', 'score': 2512.0}, {'term': 'obama', 'score': 2409.0}, {'term': 'like', 'score': 1724.0}, {'term': 'man', 'score': 1638.0}, {'term': 'biden', 'score': 1624.0}]","{'title': ""Trump's Disrespect at Carter's Funeral"", 'description': ""The posts highlight widespread criticism of Donald Trump's behavior and remarks during Jimmy Carter's funeral, contrasting his perceived rudeness and lack of dignity with Carter's legacy of humility, service, and integrity. Many express outrage over Trump's presence, comments, and perceived disrespect toward a revered former president.""}",15388
part_c,1190,"[{'term': 'trump', 'score': 24527.0}, {'term': 'jobs', 'score': 13752.0}, {'term': 'labor', 'score': 8513.0}, {'term': 'statistics', 'score': 7328.0}, {'term': 'report', 'score': 6964.0}, {'term': 'numbers', 'score': 6661.0}, {'term': 'data', 'score': 5211.0}, {'term': 'bls', 'score': 4767.0}, {'term': 'job', 'score': 4486.0}, {'term': 'bureau', 'score': 4419.0}]","{'title': 'Trump Fires BLS Chief Over Job Data', 'description': 'President Trump fires the Bureau of Labor Statistics commissioner after a weak jobs report, sparking concerns over political interference in economic data. Critics warn this undermines transparency and signals a broader attack on factual governance.'}",15372
part_d,1011,"[{'term': 'trump', 'score': 19841.0}, {'term': 'autism', 'score': 13310.0}, {'term': 'tylenol', 'score': 13028.0}, {'term': 'rfk', 'score': 2946.0}, {'term': 'acetaminophen', 'score': 2882.0}, {'term': 'jr', 'score': 2497.0}, {'term': 'women', 'score': 2382.0}, {'term': 'pregnancy', 'score': 2365.0}, {'term': 'pregnant', 'score': 2156.0}, {'term': 'use', 'score': 1971.0}]","{'title': 'Trump Links Tylenol to Autism Amid Science Backlash', 'description': 'A cluster of posts criticizes former President Donald Trump and his administration for promoting unproven claims that acetaminophen (Tylenol) used during pregnancy causes autism, despite overwhelming scientific consensus to the contrary. The posts highlight widespread concern over the spread of medical misinformation, potential stock manipulation, and the harm to public health and neurodiverse communities.'}",15311
part_a,583,"[{'term': 'trump', 'score': 16531.0}, {'term': 'abortion', 'score': 15514.0}, {'term': 'ban', 'score': 4223.0}, {'term': 'women', 'score': 4012.0}, {'term': 'republican', 'score': 3679.0}, {'term': 'rights', 'score': 2744.0}, {'term': 'states', 'score': 2717.0}, {'term': 'state', 'score': 2094.0}, {'term': 'donald', 'score': 2023.0}, {'term': 'roe', 'score': 1844.0}]","{'title': 'Trump’s Abortion Rhetoric and Reproductive Rights Under Threat', 'description': 'The posts highlight widespread concern over Donald Trump’s shifting and contradictory statements on abortion, the Republican Party’s efforts to restrict reproductive rights, and the potential for a nationwide ban under a second Trump administration. They emphasize the contradiction between Trump’s claims of moderation and his record, including supporting the overturning of Roe v. Wade and enabling state-level bans.'}",15178
part_c,1394,"[{'term': 'maga', 'score': 15442.0}, {'term': 'stupid', 'score': 1609.0}, {'term': 'just', 'score': 1214.0}, {'term': 'like', 'score': 1082.0}, {'term': 'people', 'score': 925.0}, {'term': 'think', 'score': 878.0}, {'term': 'don', 'score': 876.0}, {'term': 'know', 'score': 787.0}, {'term': 'fuck', 'score': 640.0}, {'term': 'dumb', 'score': 568.0}]","{'title': 'MAGA Criticism and Mockery', 'description': 'These posts collectively express strong disdain and mockery toward the MAGA movement, portraying its supporters as unintelligent, lacking self-awareness, and resistant to logic or facts. The tone is consistently sarcastic and hostile, emphasizing perceived absurdity and ideological extremism.'}",14858
part_a,604,"[{'term': 'trump', 'score': 18168.0}, {'term': 'epstein', 'score': 8666.0}, {'term': 'sexual', 'score': 3294.0}, {'term': 'rapist', 'score': 2388.0}, {'term': 'donald', 'score': 2270.0}, {'term': 'jeffrey', 'score': 1706.0}, {'term': 'sex', 'score': 1502.0}, {'term': 'like', 'score': 1325.0}, {'term': 'assault', 'score': 1163.0}, {'term': 'cabinet', 'score': 1162.0}]","{'title': 'Trump, Epstein, and Allegations of Sexual Abuse', 'description': 'The posts center on recurring allegations linking Donald Trump to Jeffrey Epstein, accusing Trump of being a pedophile, rapist, and sexual predator. They emphasize his alleged close relationship with Epstein, the release of tapes and documents, and the appointment of individuals with sexual misconduct histories to his administration, framing these as evidence of a pattern of predatory behavior and systemic cover-up.'}",14783
